{
  "schema_version": "1.0",
  "bundle_id": "bundle_image_main_01",
  "task_id": "task_launch_campaign",
  "work_item_id": "work_visual_01",
  "instance_id": "instance_image_01",
  "task_card_revision": 2,
  "branch_id": "branch_main",
  "checkpoint_id": "checkpoint_final_01",
  "publication_batch_id": "batch_bundle_main_01",
  "image_asset": {
    "asset_id": "asset_final_image_01",
    "manifest_relpath": "resources/manifests/asset_final_image_01.json"
  },
  "design_note_asset": {
    "asset_id": "asset_design_note_01",
    "manifest_relpath": "resources/manifests/asset_design_note_01.json"
  },
  "actor": {
    "type": "human",
    "id": "reviewer_01"
  },
  "created_at": "2026-08-22T15:00:00Z",
  "published_at": "2026-08-22T15:05:00Z"
}
